{"protocol":"anomalyx/tq1","config_version":"anomalyx-cfg/8;pt=3.5000;ptn=8;cr=true;pfdr=;da=0.0500;psi=0.2000;psib=10;dmn=20;snr=0.5000;mva=0.00100;mvn=20;mvr=1e-9;cxp=0;cxt=3.5000;cxm=4;cln=20;clt=5.0000;cdc=;cdcv=0.0500;cdn=20","source":"-","format":"csv","rows_scanned":10,"dict":["point.modz","point","cell:reading:9","critical","reading = 1000.000000: modified z-score 450.395 exceeds 3.500 (center=10.000000, scale=1.482600)"],"columns":["detector","class","handle","confidence","severity","score","reason"],"rows":[[0,1,2,1.0,3,450.3945770942938,4]],"absent":[{"detector":"dist.ks","reason":"no baseline provided; distributional drift requires --baseline"},{"detector":"dist.psi","reason":"no baseline provided; distributional drift requires --baseline"},{"detector":"dist.chi2","reason":"no baseline provided; distributional drift requires --baseline"},{"detector":"mv.mahalanobis","reason":"fewer than 20 complete numeric rows to estimate a covariance"},{"detector":"ctx.seasonal","reason":"contextual detection needs a declared period ≥ 2 (pass --period N)"},{"detector":"coll.cusum","reason":"no numeric column with ≥ 20 values and non-zero variance"},{"detector":"cad.regularity","reason":"cadence detection requires a time column (pass --cadence <COL>)"}],"roles":[{"column":"id","role":"identifier"},{"column":"reading","role":"measurement"}],"summary":{"total":1,"max_severity":"critical","by_class":[{"class":"point","count":1},{"class":"contextual","count":0},{"class":"collective","count":0},{"class":"distributional","count":0},{"class":"structural","count":0},{"class":"multivariate","count":0},{"class":"cadence","count":0}]},"exit":1}
